{
  "version": 1,
  "studentId": "ekaterina_gnedkova",
  "lessonDate": "2026-10-27",
  "topics": [
    "прикладные задачи по формуле",
    "изменение линейной величины и перевод единиц",
    "квадратичная зависимость и график параболы",
    "квадратные уравнения и неравенства",
    "продолжительность нахождения выше порога",
    "физически допустимые корни",
    "проверка размерности"
  ],
  "actualSummary": "Тепловое расширение и уровень воды; квадратичные модели траектории и температуры, неравенства, выбор допустимого корня и проверка размерности. Восемь разборов без тренировочного блока.",
  "ktpMatches": [],
  "outcomes": [
    {
      "competencyId": "ege27_10_001",
      "evidenceAnchor": "linear",
      "relation": "touched",
      "confidence": "exact",
      "decision": "apply",
      "masteryClaim": null,
      "basis": "Подстановка чисел в формулу теплового расширения и глубины"
    },
    {
      "competencyId": "ege27_10_002",
      "evidenceAnchor": "linear",
      "relation": "touched",
      "confidence": "exact",
      "decision": "apply",
      "masteryClaim": null,
      "basis": "Выражение неизвестной температуры из формулы приращения"
    },
    {
      "competencyId": "ege27_10_003",
      "evidenceAnchor": "linear",
      "relation": "touched",
      "confidence": "exact",
      "decision": "apply",
      "masteryClaim": null,
      "basis": "Перевод 3 миллиметров в метры перед подстановкой"
    },
    {
      "competencyId": "ege27_10_004",
      "evidenceAnchor": "linear",
      "relation": "touched",
      "confidence": "exact",
      "decision": "apply",
      "masteryClaim": null,
      "basis": "Линейная модель длины рельса"
    },
    {
      "competencyId": "ege27_10_005",
      "evidenceAnchor": "quadratic",
      "relation": "touched",
      "confidence": "exact",
      "decision": "apply",
      "masteryClaim": null,
      "basis": "Квадратичные модели траектории, температуры и бака"
    },
    {
      "competencyId": "ege27_10_014",
      "evidenceAnchor": "domain",
      "relation": "touched",
      "confidence": "exact",
      "decision": "apply",
      "masteryClaim": null,
      "basis": "Размерностная проверка минимальной скорости"
    },
    {
      "competencyId": "ege27_07_002",
      "evidenceAnchor": "quadratic",
      "relation": "touched",
      "confidence": "exact",
      "decision": "apply",
      "masteryClaim": null,
      "basis": "Граничные моменты находятся решением квадратных уравнений"
    },
    {
      "competencyId": "ege27_07_016",
      "evidenceAnchor": "domain",
      "relation": "touched",
      "confidence": "exact",
      "decision": "apply",
      "masteryClaim": null,
      "basis": "Из двух корней времени опустошения бака отбирается допустимый"
    },
    {
      "competencyId": "ege27_16_002",
      "evidenceAnchor": "quadratic",
      "relation": "touched",
      "confidence": "exact",
      "decision": "apply",
      "masteryClaim": null,
      "basis": "Решение квадратных неравенств для запаса высоты и длительности"
    },
    {
      "competencyId": "ege27_12_012",
      "evidenceAnchor": "quadratic",
      "relation": "touched",
      "confidence": "exact",
      "decision": "apply",
      "masteryClaim": null,
      "basis": "Парабола и её положение относительно порога"
    },
    {
      "competencyId": "ege27_17_002",
      "evidenceAnchor": "domain",
      "relation": "touched",
      "confidence": "exact",
      "decision": "apply",
      "masteryClaim": null,
      "basis": "Ограничение времени 0 ≤ t ≤ 1000 секунд для модели бака"
    }
  ],
  "warnings": []
}
