{
  "version": 1,
  "studentId": "anna_trapeznikova",
  "lessonDate": "2026-10-26",
  "topics": [
    "перевод условия прикладной задачи в уравнение",
    "единицы измерения и степени десяти",
    "линейная модель прибыли и изменение величин",
    "подстановка в квадратное уравнение",
    "квадратное неравенство и отбор корней",
    "проверка физического смысла решения"
  ],
  "actualSummary": "Прикладные задачи профильного ЕГЭ: тепловое расширение рельса, прибыль, уровень воды в колодце, спрос и выручка, давление в ведре и траектория камня. Формулы, ограничения, проверка единиц, Путь А — 10 заданий.",
  "ktpMatches": [],
  "outcomes": [
    {
      "competencyId": "systems_models_09",
      "evidenceAnchor": "translation",
      "relation": "practiced",
      "confidence": "exact",
      "decision": "apply",
      "masteryClaim": null,
      "basis": "На занятии выделяли искомую величину и переводили словесные ограничения в математическую запись."
    },
    {
      "competencyId": "systems_models_11",
      "evidenceAnchor": "units",
      "relation": "practiced",
      "confidence": "exact",
      "decision": "apply",
      "masteryClaim": null,
      "basis": "Разбирали перевод миллиметров в метры и единицы параметров физических формул."
    },
    {
      "competencyId": "systems_models_12",
      "evidenceAnchor": "physics",
      "relation": "practiced",
      "confidence": "exact",
      "decision": "apply",
      "masteryClaim": null,
      "basis": "Проверяли, почему нулевая масса воды и отрицательная скорость недопустимы как ответ по смыслу задачи."
    },
    {
      "competencyId": "real_numbers_20",
      "evidenceAnchor": "units",
      "relation": "practiced",
      "confidence": "exact",
      "decision": "apply",
      "masteryClaim": null,
      "basis": "Переписывали десятичные числа с отрицательными степенями десяти для удобного вычисления."
    },
    {
      "competencyId": "powers_roots_01",
      "evidenceAnchor": "units",
      "relation": "practiced",
      "confidence": "exact",
      "decision": "apply",
      "masteryClaim": null,
      "basis": "При вычислении длины применяли свойства степеней десяти."
    },
    {
      "competencyId": "polynomials_09",
      "evidenceAnchor": "quadratic",
      "relation": "practiced",
      "confidence": "exact",
      "decision": "apply",
      "masteryClaim": null,
      "basis": "При решении квадратного уравнения выручки находили два корня 4 и 8 по Виету."
    },
    {
      "competencyId": "rational_equations_07",
      "evidenceAnchor": "quadratic",
      "relation": "practiced",
      "confidence": "exact",
      "decision": "apply",
      "masteryClaim": null,
      "basis": "Подстановка одной формулы в другую приводила к квадратному уравнению."
    },
    {
      "competencyId": "rational_equations_09",
      "evidenceAnchor": "quadratic",
      "relation": "touched",
      "confidence": "exact",
      "decision": "apply",
      "masteryClaim": null,
      "basis": "Разбирали пороги и выбор наибольшей цены; чек-лист закрепляет неравенство."
    },
    {
      "competencyId": "functions_01",
      "evidenceAnchor": "translation",
      "relation": "touched",
      "confidence": "exact",
      "decision": "apply",
      "masteryClaim": null,
      "basis": "Уточнялся смысл записи L(t) как зависимости величины от аргумента."
    }
  ],
  "warnings": [
    "Rolling KTP has no scheduled items; KTP mapping not inferred.",
    "Evidence records touched/practiced skills; no mastery increases without an explicit independent assessment."
  ]
}
