{
  "version": 1,
  "studentId": "jaroslav_vereschagin",
  "lessonDate": "2026-10-29",
  "topics": [
    "Нормализация квадратных неравенств",
    "Вынесение общего множителя",
    "ОДЗ и нули знаменателя",
    "Приведение к общему знаменателю и правило ВУПС",
    "Метод интервалов и знаки",
    "Замена повторяющегося квадратного выражения"
  ],
  "actualSummary": "29.10.26. Метод интервалов: нормализация, общие множители и знаменатели, исключение нулей знаменателя, правило скобок ВУПС, замена полного квадратного выражения и 10 заданий Пути А.",
  "ktpMatches": [],
  "outcomes": [
    {
      "competencyId": "oge_20_2_1",
      "evidenceAnchor": "method",
      "relation": "practiced",
      "confidence": "exact",
      "decision": "apply",
      "masteryClaim": null,
      "basis": "Разобран выбор метода интервалов после нормализации квадратного и рационального неравенства."
    },
    {
      "competencyId": "oge_20_2_2",
      "evidenceAnchor": "domain",
      "relation": "practiced",
      "confidence": "exact",
      "decision": "apply",
      "masteryClaim": null,
      "basis": "Ученик отрабатывал исключение нулей знаменателя, включая нестрогие дробные неравенства."
    },
    {
      "competencyId": "oge_20_2_3",
      "evidenceAnchor": "fractions",
      "relation": "practiced",
      "confidence": "exact",
      "decision": "apply",
      "masteryClaim": null,
      "basis": "Приведение дробей к общему знаменателю и правило ВУПС отрабатывались с исправлением ошибок."
    },
    {
      "competencyId": "oge_20_2_4",
      "evidenceAnchor": "method",
      "relation": "practiced",
      "confidence": "exact",
      "decision": "apply",
      "masteryClaim": null,
      "basis": "На числовой прямой определялись промежутки нужного знака после нахождения критических точек."
    },
    {
      "competencyId": "oge_20_2_5",
      "evidenceAnchor": "training",
      "relation": "touched",
      "confidence": "exact",
      "decision": "apply",
      "masteryClaim": null,
      "basis": "Контроль знаков и скобок обсуждался; общего независимого подтверждения mastery нет."
    },
    {
      "competencyId": "oge_13_2_3",
      "evidenceAnchor": "normal",
      "relation": "practiced",
      "confidence": "exact",
      "decision": "apply",
      "masteryClaim": null,
      "basis": "Корни квадратного трёхчлена отмечались на числовой прямой и проверялся знак между ними."
    },
    {
      "competencyId": "oge_13_2_4",
      "evidenceAnchor": "factor",
      "relation": "practiced",
      "confidence": "exact",
      "decision": "apply",
      "masteryClaim": null,
      "basis": "Разбиралась запись строгих неравенств через круглые скобки и выбор граничных точек."
    },
    {
      "competencyId": "oge_8_3_2",
      "evidenceAnchor": "substitution",
      "relation": "practiced",
      "confidence": "exact",
      "decision": "apply",
      "masteryClaim": null,
      "basis": "Разобрана замена полного повторяющегося квадратного выражения и общий знаменатель в новой переменной."
    }
  ],
  "warnings": [
    "Rolling KTP пока не содержит уроков; ktpRefs не назначены.",
    "Работа велась с преподавателем: masteryClaim отсутствует для всех outcomes."
  ]
}
