{
  "version": 1,
  "studentId": "anna_bannova",
  "lessonDate": "2026-10-16",
  "topics": [
    "преобразование степенных выражений",
    "дробные и отрицательные показатели",
    "степенные уравнения и полнота корней",
    "прикладные задачи на кубическую зависимость",
    "показательная модель радиоактивного распада",
    "пороговые неравенства"
  ],
  "actualSummary": "Анна повторила преобразование степеней с дробными и отрицательными показателями, отдельно разобрала получение всех действительных корней в степенных уравнениях. На материале силы натяжения троса и радиоактивного распада выполняла чтение формулы, извлечение данных, подстановку, решение уравнений/неравенств и отбор граничных значений. Самостоятельно завершала аналогичные задачи после образца; требуется сохранять проверки области допустимых значений и смысл знаков ограничения.",
  "ktpMatches": [
    {
      "ktpId": "ktp-029",
      "confidence": "exact",
      "decision": "apply",
      "coverage": "partial",
      "reason": "Повторены дробные и отрицательные показатели, разложение чисел и группировка оснований; расширенное изучение темы было проведено ранее."
    },
    {
      "ktpId": "ktp-030",
      "confidence": "exact",
      "decision": "apply",
      "coverage": "partial",
      "reason": "Выражения с составными основаниями переводились в степенную форму и упрощались; это текущая практика уже изученного алгоритма."
    },
    {
      "ktpId": "ktp-032",
      "confidence": "exact",
      "decision": "apply",
      "coverage": "partial",
      "reason": "Разобраны действительные корни x^(4/3)=16, x^(-4)=81 и аналогичные уравнения; другие методы из полного раздела остаются для дальнейшего изучения."
    },
    {
      "ktpId": "ktp-035",
      "confidence": "exact",
      "decision": "apply",
      "coverage": "partial",
      "reason": "Две прикладные модели со степенями — сила натяжения для кубического зонда и экспоненциальный распад — доведены до граничного значения; это первое знакомство с блоком."
    }
  ],
  "outcomes": [
    {
      "competencyId": "calc_09",
      "evidenceAnchor": "powers",
      "relation": "practiced",
      "confidence": "exact",
      "decision": "apply",
      "masteryClaim": null,
      "basis": "Повторены отрицательные степени, группировка оснований и восстановление значения дроби."
    },
    {
      "competencyId": "calc_10",
      "evidenceAnchor": "powers",
      "relation": "practiced",
      "confidence": "exact",
      "decision": "apply",
      "masteryClaim": null,
      "basis": "Выполнялись операции с дробными показателями, преобразование составных чисел в точные степени."
    },
    {
      "competencyId": "expr_12",
      "evidenceAnchor": "powers",
      "relation": "practiced",
      "confidence": "exact",
      "decision": "apply",
      "masteryClaim": null,
      "basis": "Разбирались и самостоятельно использовались преобразования составных степенных выражений."
    },
    {
      "competencyId": "expr_13",
      "evidenceAnchor": "equations",
      "relation": "practiced",
      "confidence": "exact",
      "decision": "apply",
      "masteryClaim": null,
      "basis": "Связь дробного показателя с корнем была применена к степенным уравнениям и кубическим корням."
    },
    {
      "competencyId": "eq_09",
      "evidenceAnchor": "decay",
      "relation": "practiced",
      "confidence": "exact",
      "decision": "apply",
      "masteryClaim": null,
      "basis": "Уравнение 2^(-t/T)=1/8 сводилось к равенству показателей при общем основании 2."
    },
    {
      "competencyId": "ineq_11",
      "evidenceAnchor": "decay",
      "relation": "touched",
      "confidence": "exact",
      "decision": "apply",
      "masteryClaim": null,
      "basis": "Обсуждалось сохранение направления и смысл порогового показательного неравенства, самостоятельный диагностический контроль не проводился."
    }
  ],
  "warnings": [
    "Степенные уравнения с четвёртой степенью требуют учёта обоих действительных корней.",
    "Пороговые условия F ≤ предел и m(t) ≥ порог сохраняют знак при решении; равенство используется для нахождения границы.",
    "Оснований для автоматического повышения уровней карты компетенций по этому занятию недостаточно."
  ]
}
