{
  "version": 1,
  "studentId": "timofey",
  "lessonDate": "2026-10-17",
  "topics": [
    "вклад с пополнением",
    "универсальная кредитная таблица",
    "произвольная схема погашения",
    "аннуитетные платежи",
    "дифференцированная схема"
  ],
  "actualSummary": "Вклады с пополнением и таблица изменения долга; распознавание произвольной, дифференцированной и аннуитетной схем по условию; расчёт последнего и равного платежа.",
  "ktpMatches": [],
  "outcomes": [
    {
      "competencyId": "t16_deposits",
      "evidenceAnchor": "deposit-model",
      "relation": "practiced",
      "confidence": "exact",
      "decision": "apply",
      "masteryClaim": null,
      "basis": "Ученик вместе с преподавателем составлял таблицу вклада и обсуждал переход от k к процентной ставке."
    },
    {
      "competencyId": "t16_deposit_contrib",
      "evidenceAnchor": "deposit-model",
      "relation": "practiced",
      "confidence": "exact",
      "decision": "apply",
      "masteryClaim": null,
      "basis": "На занятии составлена двухлетняя схема с пополнением в начале следующего года."
    },
    {
      "competencyId": "t16_credits",
      "evidenceAnchor": "scheme-key",
      "relation": "practiced",
      "confidence": "exact",
      "decision": "apply",
      "masteryClaim": null,
      "basis": "В конце занятия ученик последовательно определял произвольную, дифференцированную и аннуитетную схемы по условию."
    },
    {
      "competencyId": "t16_debt_table",
      "evidenceAnchor": "arbitrary-ledger",
      "relation": "practiced",
      "confidence": "exact",
      "decision": "apply",
      "masteryClaim": null,
      "basis": "Ученик заполнял расчётную таблицу для кредита со снижением остатка на фиксированный процент, педагог корректировал шаги."
    },
    {
      "competencyId": "t16_variable",
      "evidenceAnchor": "arbitrary-ledger",
      "relation": "practiced",
      "confidence": "exact",
      "decision": "apply",
      "masteryClaim": null,
      "basis": "В задаче на четыре года обсуждены остатки 0,6S, 0,36S, 0,216S и вычисление каждого платежа."
    },
    {
      "competencyId": "t16_annuity",
      "evidenceAnchor": "annuity-ledger",
      "relation": "practiced",
      "confidence": "exact",
      "decision": "apply",
      "masteryClaim": null,
      "basis": "Ученик строил таблицу с одинаковыми платежами x, преподаватель уточнял обозначения и число периодов."
    },
    {
      "competencyId": "t16_model_equation",
      "evidenceAnchor": "annuity-ledger",
      "relation": "practiced",
      "confidence": "exact",
      "decision": "apply",
      "masteryClaim": null,
      "basis": "Разобран переход от двухстрочной таблицы к уравнению (Sk−x)k−x=0."
    },
    {
      "competencyId": "t16_equal_reduction",
      "evidenceAnchor": "differentiated-ledger",
      "relation": "touched",
      "confidence": "exact",
      "decision": "apply",
      "masteryClaim": null,
      "basis": "Распознавание по фразе «на одну и ту же сумму меньше», без самостоятельного численного решения в данном эпизоде."
    },
    {
      "competencyId": "t16_payment_sum",
      "evidenceAnchor": "annuity-ledger",
      "relation": "touched",
      "confidence": "exact",
      "decision": "apply",
      "masteryClaim": null,
      "basis": "Преподаватель подчеркнул необходимость умножить ежегодный платёж на число выплат при вопросе об общей сумме."
    }
  ],
  "warnings": [
    "У ученика rolling KTP без запланированных уроков; ktpMatches пуст. По занятию уровни mastery не повышаются без отдельного подтверждённого оценивания."
  ]
}
