{
  "version": 1,
  "studentId": "volodia_khachaturian_math",
  "lessonDate": "2026-10-26",
  "topics": [
    "Пропорции и диагональный перенос",
    "Выражение величин из физических формул",
    "Линейные и дробные уравнения",
    "Работа с отрицательными коэффициентами",
    "Скобки и правило ВУПС"
  ],
  "actualSummary": "Разобраны свойства пропорций, выражение неизвестных из формулы всемирного тяготения, четыре базовые схемы равенств, линейные и дробные уравнения, сохранение знака коэффициента и правило ВУПС. Самостоятельная работа требует дальнейшего закрепления; назначен путь Б на шесть дней.",
  "ktpMatches": [],
  "outcomes": [
    {
      "competencyId": "oge_9_1_1",
      "evidenceAnchor": "linear",
      "relation": "practiced",
      "confidence": "exact",
      "decision": "apply",
      "masteryClaim": null,
      "basis": "На занятии ученик преобразовывал 4x+1=10x−3; рассматривались переносы и коэффициент −6. Освоение самостоятельно не подтверждено."
    },
    {
      "competencyId": "oge_9_1_2",
      "evidenceAnchor": "fraction-equations",
      "relation": "touched",
      "confidence": "exact",
      "decision": "apply",
      "masteryClaim": null,
      "basis": "В пособии и на доске сопоставлены три способа решения 3/(4x+1)=10. Выбор метода обсуждался."
    },
    {
      "competencyId": "oge_9_1_3",
      "evidenceAnchor": "negative",
      "relation": "practiced",
      "confidence": "exact",
      "decision": "apply",
      "masteryClaim": null,
      "basis": "В задаче 8/(−2x+3)=2 ученик тренировался искать x, работая с отрицательным коэффициентом."
    },
    {
      "competencyId": "oge_9_1_4",
      "evidenceAnchor": "fraction-equations",
      "relation": "touched",
      "confidence": "exact",
      "decision": "apply",
      "masteryClaim": null,
      "basis": "В пособии приведена проверка x=−7/40 подстановкой; независимая проверка учеником не установлена."
    },
    {
      "competencyId": "oge_12_1_4",
      "evidenceAnchor": "physics",
      "relation": "practiced",
      "confidence": "exact",
      "decision": "apply",
      "masteryClaim": null,
      "basis": "На занятии выражали m₁,m₂,R²,R из F=Gm₁m₂/R²."
    },
    {
      "competencyId": "oge_8_3_2",
      "evidenceAnchor": "wups",
      "relation": "practiced",
      "confidence": "exact",
      "decision": "apply",
      "masteryClaim": null,
      "basis": "Отрабатывались разность, произведение и подстановка составных выражений со скобками, а также распределительный закон."
    },
    {
      "competencyId": "oge_20_1_2",
      "evidenceAnchor": "denominator",
      "relation": "touched",
      "confidence": "exact",
      "decision": "apply",
      "masteryClaim": null,
      "basis": "В пособии зафиксировано ограничение 4x+1≠0 и проверка знаменателя дробного уравнения."
    },
    {
      "competencyId": "oge_6_1_3",
      "evidenceAnchor": "negative",
      "relation": "practiced",
      "confidence": "exact",
      "decision": "apply",
      "masteryClaim": null,
      "basis": "В пособии разобраны сокращение дроби −4/−6 и знак числителя/знаменателя."
    }
  ],
  "warnings": []
}
