{
  "version": 1,
  "studentId": "xenia_klykova",
  "lessonDate": "2026-10-17",
  "topics": [
    "площади треугольников",
    "векторы и скалярное произведение",
    "вложенные события и два испытания",
    "математическое ожидание",
    "степени с общим основанием",
    "квадратичная модель движения",
    "текстовая задача на скорость"
  ],
  "actualSummary": "Ксения Клыкова · повторение профильного ЕГЭ 17 октября 2026: площадь треугольника, векторы, вероятности, математическое ожидание, степени, квадратичная модель движения и текстовые задачи.",
  "ktpMatches": [],
  "outcomes": [
    {
      "competencyId": "t1_areas",
      "evidenceAnchor": "area",
      "relation": "practiced",
      "confidence": "exact",
      "decision": "apply",
      "masteryClaim": null,
      "basis": "На занятии вспоминали формулы площади; Ксения назвала формулу через две стороны и синус угла, затем разобрали пример с равнобедренным треугольником."
    },
    {
      "competencyId": "t2_dot",
      "evidenceAnchor": "vectors",
      "relation": "practiced",
      "confidence": "exact",
      "decision": "apply",
      "masteryClaim": null,
      "basis": "Повторено умножение вектора на число и скалярное произведение; Ксения выполнила дополнительные задания, преподаватель отметил корректное вычисление после поправки в записи скобок."
    },
    {
      "competencyId": "t5_sum",
      "evidenceAnchor": "probability",
      "relation": "practiced",
      "confidence": "exact",
      "decision": "apply",
      "masteryClaim": null,
      "basis": "Разобрана разность вложенных событий для числа пассажиров и сумма несовместных сценариев двух матчей. Задания на закрепление выполнялись с обсуждением."
    },
    {
      "competencyId": "t5_product",
      "evidenceAnchor": "probability",
      "relation": "practiced",
      "confidence": "exact",
      "decision": "apply",
      "masteryClaim": null,
      "basis": "По таблице двух матчей построены вероятности попарных результатов как произведения при допущении независимости."
    },
    {
      "competencyId": "ege2027_t6_expectation",
      "evidenceAnchor": "expectation",
      "relation": "practiced",
      "confidence": "exact",
      "decision": "apply",
      "masteryClaim": null,
      "basis": "Значения числа бутылок переводили в распределение по относительным частотам и вычисляли взвешенную сумму; Ксения отрабатывала дополнительный пример."
    },
    {
      "competencyId": "t7_power_actions",
      "evidenceAnchor": "powers",
      "relation": "touched",
      "confidence": "exact",
      "decision": "apply",
      "masteryClaim": null,
      "basis": "Преподаватель объяснил преобразование 25 и 125 к степеням пятёрки и сравнение показателей, без независимой проверки данного преобразования."
    },
    {
      "competencyId": "t9_power",
      "evidenceAnchor": "trajectory",
      "relation": "practiced",
      "confidence": "exact",
      "decision": "apply",
      "masteryClaim": null,
      "basis": "Разобрана модель h(t) с двумя моментами достижения высоты и вычитанием времени; Ксения решила дополнительную числовую задачу."
    },
    {
      "competencyId": "t10_line",
      "evidenceAnchor": "motion",
      "relation": "practiced",
      "confidence": "exact",
      "decision": "apply",
      "masteryClaim": null,
      "basis": "Составлена модель движения с разницей скоростей и временем прибытия; Ксения самостоятельно оформила дополнительную таблицу и уравнение без замечаний преподавателя."
    },
    {
      "competencyId": "t9_units",
      "evidenceAnchor": "motion",
      "relation": "practiced",
      "confidence": "exact",
      "decision": "apply",
      "masteryClaim": null,
      "basis": "В обсуждении ученик перевёл 40 и 15 минут в часы и использовал дробную запись в уравнении на движение."
    }
  ],
  "warnings": []
}
