{
  "version": 1,
  "studentId": "xenia_klykova",
  "lessonDate": "2026-10-28",
  "topics": [
    "каноническое разложение и выбор показателей простых множителей",
    "условие кратности и границы для показателей делителя",
    "чётные и нечётные делители",
    "делители-квадраты и делители-кубы",
    "пересечение ограничений и запрет кратности",
    "подсчёт числа подходящих делителей"
  ],
  "actualSummary": "Делители натуральных чисел с ограничениями: кратность 6, 12, 45, чётные и нечётные делители, квадраты и кубы, пересечение допустимых показателей.",
  "ktpMatches": [],
  "outcomes": [
    {
      "competencyId": "t19_primes",
      "evidenceAnchor": "canonical",
      "relation": "practiced",
      "masteryClaim": null,
      "confidence": "exact",
      "decision": "apply",
      "basis": "На занятии Ксения раскладывала 72 на простые множители и использовала показатели в канонической записи."
    },
    {
      "competencyId": "t19_divisibility",
      "evidenceAnchor": "multiples",
      "relation": "practiced",
      "masteryClaim": null,
      "confidence": "exact",
      "decision": "apply",
      "basis": "На примере делителей 72, кратных 6, Ксения формулировала ограничения на показатели простых множителей."
    },
    {
      "competencyId": "t19_divisor_count",
      "evidenceAnchor": "powers",
      "relation": "practiced",
      "masteryClaim": null,
      "confidence": "exact",
      "decision": "apply",
      "basis": "Разбирались формулы подсчёта делителей, которые являются квадратами или кубами; была самостоятельная проба применения формулы."
    },
    {
      "competencyId": "t19_parity",
      "evidenceAnchor": "parity",
      "relation": "practiced",
      "masteryClaim": null,
      "confidence": "exact",
      "decision": "apply",
      "basis": "Обсуждалась чётность делителей 360 и 72; Ксения предлагала вычитание количества нечётных из общего количества."
    }
  ],
  "warnings": [
    "PDF и акварельный постер занятия остаются в чате и отсутствуют в GitHub; ссылки на них в сайте не публикуются. Исходный TeX размещён в tex_docs и доступен со страницы урока."
  ]
}
