{
  "version": 1,
  "studentId": "jaroslav_gavrilov",
  "lessonDate": "2026-10-26",
  "topics": [
    "Определение логарифма, условия допустимости и простейшие значения",
    "Вынесение показателя степени аргумента и основания",
    "Сумма, разность логарифмов и приведение к одному основанию",
    "Основное логарифмическое тождество",
    "Переход к новому основанию и взаимно обратные логарифмы",
    "Алгоритм вычисления выражений с логарифмами",
    "Самостоятельная тренировка: Путь А, 10 заданий"
  ],
  "actualSummary": "На занятии 26.10.2026 введены определение логарифма, свойства степеней аргумента и основания, формулы суммы и разности, основное логарифмическое тождество и переход к новому основанию. Упражнения выполнялись с пояснениями преподавателя; отдельная независимая диагностика уровня освоения не проводилась.",
  "ktpMatches": [
    {
      "ktpId": "ktp-018",
      "confidence": "exact",
      "decision": "apply",
      "coverage": "partial",
      "reason": "Вычисляли логарифмы и преобразовывали выражения; разобраны определение, ОДЗ, сумма, разность, степени и переход к новому основанию. Полный контрольный блок навыков ещё предстоит."
    }
  ],
  "outcomes": [
    {
      "competencyId": "ege08_08",
      "evidenceAnchor": "meaning",
      "relation": "practiced",
      "confidence": "exact",
      "decision": "apply",
      "masteryClaim": null,
      "basis": "Определение логарифма и равенство log_a b=x ⇔ a^x=b разобраны на примере log_2 8."
    },
    {
      "competencyId": "ege08_09",
      "evidenceAnchor": "identity",
      "relation": "practiced",
      "confidence": "exact",
      "decision": "apply",
      "masteryClaim": null,
      "basis": "Тождество a^(log_a b)=b использовано в примерах 3^(2log_3 5) и 9^(log_3 5)."
    },
    {
      "competencyId": "ege08_10",
      "evidenceAnchor": "combine",
      "relation": "practiced",
      "confidence": "exact",
      "decision": "apply",
      "masteryClaim": null,
      "basis": "Отработаны вынос показателя у аргумента и основания, сумма и разность логарифмов при общих основаниях."
    },
    {
      "competencyId": "ege08_11",
      "evidenceAnchor": "change",
      "relation": "practiced",
      "confidence": "exact",
      "decision": "apply",
      "masteryClaim": null,
      "basis": "Разобраны формула перехода к новому основанию и взаимная обратность log_a b и log_b a."
    },
    {
      "competencyId": "ege08_02",
      "evidenceAnchor": "route",
      "relation": "touched",
      "confidence": "exact",
      "decision": "apply",
      "masteryClaim": null,
      "basis": "Отрицательные степени в дробях: 1/9=3^(-2), 0,25=2^(-2)."
    },
    {
      "competencyId": "ege08_03",
      "evidenceAnchor": "powers",
      "relation": "practiced",
      "confidence": "exact",
      "decision": "apply",
      "masteryClaim": null,
      "basis": "Корни преобразованы в дробные показатели при вычислении логарифмов."
    },
    {
      "competencyId": "ege08_06",
      "evidenceAnchor": "powers",
      "relation": "touched",
      "confidence": "exact",
      "decision": "apply",
      "masteryClaim": null,
      "basis": "Корни пятой и третьей степени представлены степенями положительного основания."
    }
  ],
  "warnings": [
    "Связать урок с KTP-018 по содержанию, несмотря на более позднюю плановую дату.",
    "Mastery levels не повышать без отдельной самостоятельной диагностики."
  ]
}
