{
  "version": 1,
  "studentId": "sofya_kalney",
  "lessonDate": "2026-10-21",
  "topics": [
    "Теорема о биссектрисе и обратное утверждение",
    "Центр вписанной окружности",
    "Две последовательные пропорции в треугольнике",
    "Отношения отрезков и периметр"
  ],
  "actualSummary": "Биссектриса и отношение частей стороны, центр вписанной окружности, поиск CI:ID и решение задач с периметром. Геометрия ОГЭ, 21 октября 2026 года.",
  "ktpMatches": [],
  "outcomes": [
    {
      "competencyId": "oge_15_2_3",
      "evidenceAnchor": "theorem",
      "relation": "practiced",
      "confidence": "exact",
      "decision": "apply",
      "masteryClaim": null,
      "basis": "Разбиралась пропорция CK:KB=AC:AB; ученица решала задачу на части стороны с помощью преподавателя."
    },
    {
      "competencyId": "oge_16_3_2",
      "evidenceAnchor": "incenter",
      "relation": "practiced",
      "confidence": "exact",
      "decision": "apply",
      "masteryClaim": null,
      "basis": "Разбирались пересечение биссектрис и отношение CI:ID, привязанное к сторонам треугольника."
    },
    {
      "competencyId": "oge_23_2_2",
      "evidenceAnchor": "method",
      "relation": "practiced",
      "confidence": "exact",
      "decision": "apply",
      "masteryClaim": null,
      "basis": "При решении составной задачи выбирали сначала треугольник ABC, затем ACD."
    },
    {
      "competencyId": "oge_23_2_3",
      "evidenceAnchor": "incenter",
      "relation": "practiced",
      "confidence": "exact",
      "decision": "apply",
      "masteryClaim": null,
      "basis": "Решена составная задача с последовательными пропорциями; на аналогичном задании потребовалась помощь."
    },
    {
      "competencyId": "oge_25_1_2",
      "evidenceAnchor": "perimeter",
      "relation": "touched",
      "confidence": "exact",
      "decision": "apply",
      "masteryClaim": null,
      "basis": "Рассмотрен вывод AB из известного отношения CI:ID и периметра P=48."
    },
    {
      "competencyId": "oge_23_2_4",
      "evidenceAnchor": "method",
      "relation": "touched",
      "confidence": "exact",
      "decision": "apply",
      "masteryClaim": null,
      "basis": "Разобрано неравенство CI>ID как следствие неравенства треугольника."
    }
  ],
  "warnings": []
}
