{
  "version": 1,
  "studentId": "ekaterina_gnedkova",
  "lessonDate": "2026-10-28",
  "topics": [
    "метод позиций и правило умножения",
    "цифры с повторениями и без повторений",
    "факториал и перестановки",
    "упорядоченный и неупорядоченный выбор",
    "ограничения на цифры и делимость",
    "книги рядом как единый блок",
    "формула числа диагоналей многоугольника"
  ],
  "actualSummary": "Основы комбинаторики: правило умножения, метод позиций, повторения, факториал, порядок выбора, кратность и диагонали многоугольника. Десять задач «Путь А» и цифровая лаборатория.",
  "ktpMatches": [],
  "outcomes": [
    {
      "competencyId": "ege27_04_014",
      "evidenceAnchor": "positions",
      "relation": "practiced",
      "basis": "Метод позиций и комбинаторный подсчёт вариантов на разрядах чисел и этапах маршрута; самостоятельные решения во время занятия.",
      "confidence": "exact",
      "decision": "apply",
      "masteryClaim": null
    },
    {
      "competencyId": "ege27_20_015",
      "evidenceAnchor": "order",
      "relation": "practiced",
      "basis": "Различение упорядоченного и неупорядоченного выбора, факториал, выбор пары и исключение повторного подсчёта.",
      "confidence": "exact",
      "decision": "apply",
      "masteryClaim": null
    }
  ],
  "warnings": []
}
