{
  "version": 1,
  "studentId": "nikol_sarkisyants",
  "lessonDate": "2026-10-19",
  "topics": [
    "дифференцированный кредит",
    "показательно-тригонометрическое уравнение",
    "формулы корней",
    "двойной угол и формулы приведения",
    "логарифмические неравенства",
    "двухступенчатая ОДЗ"
  ],
  "actualSummary": "Повторение ЕГЭ: вычисление ставки дифференцированного кредита, показательно-тригонометрические уравнения с заменой, формулы тригонометрических корней, преобразование выражений по двойному углу и приведение, вложенные логарифмические неравенства с обязательной ОДЗ.",
  "ktpMatches": [],
  "outcomes": [
    {
      "competencyId": "t16_diff",
      "evidenceAnchor": "finance",
      "relation": "practiced",
      "confidence": "exact",
      "decision": "apply",
      "masteryClaim": null,
      "basis": "Вспомнили формулу общей суммы выплат, рассчитали ставку по сумме кредита и выплат."
    },
    {
      "competencyId": "t13_trig_exp",
      "evidenceAnchor": "substitution",
      "relation": "practiced",
      "confidence": "exact",
      "decision": "apply",
      "masteryClaim": null,
      "basis": "Выполнена замена t=sin²(3x), преобразование степеней и обратный переход к корням."
    },
    {
      "competencyId": "t6_trig_special",
      "evidenceAnchor": "roots",
      "relation": "touched",
      "confidence": "exact",
      "decision": "apply",
      "masteryClaim": null,
      "basis": "На занятии выявлена необходимость закрепить формулы общих решений и понижение степени; формулы включены в пособие для повторения."
    },
    {
      "competencyId": "t7_trig_num",
      "evidenceAnchor": "transform",
      "relation": "practiced",
      "confidence": "exact",
      "decision": "apply",
      "masteryClaim": null,
      "basis": "Разобрано выражение 6sin95°cos95°/sin170° с формулами двойного угла и приведения."
    },
    {
      "competencyId": "t7_reduction",
      "evidenceAnchor": "transform",
      "relation": "practiced",
      "confidence": "exact",
      "decision": "apply",
      "masteryClaim": null,
      "basis": "Разбирались синусы углов 180°+10° и 180°−10° и правильный знак."
    },
    {
      "competencyId": "t15_log_other",
      "evidenceAnchor": "logs",
      "relation": "practiced",
      "confidence": "exact",
      "decision": "apply",
      "masteryClaim": null,
      "basis": "Разобрано неравенство с двумя логарифмами, двумя ступенями ОДЗ и пересечением интервалов."
    },
    {
      "competencyId": "t15_log_radical",
      "evidenceAnchor": "logs",
      "relation": "touched",
      "confidence": "exact",
      "decision": "apply",
      "masteryClaim": null,
      "basis": "Сравнивали √3−1 и √3+1 с единицей, проверяли направление знака."
    }
  ],
  "warnings": [
    "План KTP содержит пустой список уроков: датированная привязка невозможна.",
    "Обучение и практика не дают оснований автоматически повышать mastery; уровни оставлены без изменений."
  ]
}
