{
  "version": 1,
  "studentId": "anna_bannova",
  "lessonDate": "2026-10-09",
  "topics": [
    "степени",
    "корни и дробные показатели",
    "преобразование степенных выражений",
    "подстановка аргумента функции",
    "показательные уравнения",
    "уравнения с неизвестным в основании",
    "проверка корней и ограничений"
  ],
  "actualSummary": "Закреплены умножение и деление степеней с одинаковым основанием, переход от корней к дробным показателям и контроль скобок. Разобраны подстановка аргумента функции и постоянство частного показательных функций, решение простых показательных уравнений с общим основанием, уравнений с неизвестным основанием и отрицательным показателем. В самостоятельной работе верно применялись формулы в вычислениях; при некоторых показательных уравнениях и знаках потребовалось уточнение. Сохранить повторение скобок, дробных показателей и обоих действительных корней.",
  "ktpMatches": [
    {
      "ktpId": "ktp-029",
      "confidence": "exact",
      "decision": "apply",
      "coverage": "complete",
      "reason": "Повторены дробные показатели и перевод корней в степенной вид; пункт уже завершён на предыдущем занятии."
    },
    {
      "ktpId": "ktp-030",
      "confidence": "exact",
      "decision": "apply",
      "coverage": "complete",
      "reason": "Продолжена практика преобразования произведений, частных и составных степенных выражений; пункт ранее пройден."
    },
    {
      "ktpId": "ktp-032",
      "confidence": "exact",
      "decision": "apply",
      "coverage": "partial",
      "reason": "Разобрано приведение показательных уравнений к общему основанию и простейшие степенные уравнения, но замена переменной и монотонность ещё не изучены в полном объёме."
    }
  ],
  "outcomes": [
    {
      "competencyId": "calc_09",
      "evidenceAnchor": "powers",
      "relation": "practiced",
      "confidence": "exact",
      "decision": "apply",
      "masteryClaim": null,
      "basis": "Применялись правила нулевой, отрицательной и целой степени; в работе обращалось внимание на вычислительную точность."
    },
    {
      "competencyId": "calc_10",
      "evidenceAnchor": "roots",
      "relation": "practiced",
      "confidence": "exact",
      "decision": "apply",
      "masteryClaim": null,
      "basis": "Корни переводились в дробные показатели и объединялись по правилам деления и умножения."
    },
    {
      "competencyId": "expr_12",
      "evidenceAnchor": "evidence-powers",
      "relation": "practiced",
      "confidence": "exact",
      "decision": "apply",
      "masteryClaim": null,
      "basis": "В самостоятельной практике упрощались выражения со степенями; ошибки в скобках и знаках отдельно разобраны."
    },
    {
      "competencyId": "expr_13",
      "evidenceAnchor": "fractional",
      "relation": "practiced",
      "confidence": "exact",
      "decision": "apply",
      "masteryClaim": null,
      "basis": "Разбирались составные дробные показатели и арифметические действия с ними."
    },
    {
      "competencyId": "eq_09",
      "evidenceAnchor": "evidence-equations",
      "relation": "practiced",
      "confidence": "exact",
      "decision": "apply",
      "masteryClaim": null,
      "basis": "Решались задания на приведение показательных уравнений к общему основанию; часть решений потребовала пояснений преподавателя."
    }
  ],
  "warnings": [
    "Индивидуальная карта навыков не содержит отдельного точного идентификатора для аргумента функции в этом уроке; материал отражён в тексте урока без изменения mastery.",
    "Материал по степенным уравнениям с неизвестным основанием зафиксирован на странице; mastery не повышается без отдельной диагностики."
  ]
}
