{
  "version": 1,
  "studentId": "nastya_pavlova",
  "lessonDate": "2026-10-19",
  "topics": [
    "Начисление процентов и капитализация",
    "Коэффициент роста и формула сложных процентов",
    "Ежегодные пополнения в начале года",
    "Снятие средств и отрицательный взнос",
    "Обратная задача на первоначальную сумму",
    "Изменение процентной ставки по годам"
  ],
  "actualSummary": "Сложные проценты на вкладах: ежегодная капитализация, дополнительные взносы и снятия, обратная задача, вычисления при меняющихся ставках.",
  "ktpMatches": [],
  "outcomes": [
    {
      "competencyId": "fin_02",
      "evidenceAnchor": "formula",
      "relation": "practiced",
      "confidence": "exact",
      "decision": "apply",
      "masteryClaim": null,
      "basis": "В занятии выведена формула S_n=S·k^n; выполнялись расчёты по таблице и через степени коэффициента."
    },
    {
      "competencyId": "fin_03",
      "evidenceAnchor": "growth",
      "relation": "practiced",
      "confidence": "exact",
      "decision": "apply",
      "masteryClaim": null,
      "basis": "Составлялась таблица: начальная сумма, начисленный процент, итог за каждый год; ученица заполняла аналогичные таблицы."
    },
    {
      "competencyId": "app_09",
      "evidenceAnchor": "deposits",
      "relation": "practiced",
      "confidence": "exact",
      "decision": "apply",
      "masteryClaim": null,
      "basis": "Разбирались постоянные взносы с начала второго года и формулы для двух, трёх и четырёх лет; применялись при решении задач."
    },
    {
      "competencyId": "text_16",
      "evidenceAnchor": "inverse",
      "relation": "practiced",
      "confidence": "exact",
      "decision": "apply",
      "masteryClaim": null,
      "basis": "Решалась задача с известной конечной суммой 173,28 тыс. руб. и неизвестным первоначальным вкладом."
    },
    {
      "competencyId": "fin_04",
      "evidenceAnchor": "variable",
      "relation": "touched",
      "confidence": "exact",
      "decision": "apply",
      "masteryClaim": null,
      "basis": "Обсуждалась ситуация изменения ставки по годам и необходимость таблицы; самостоятельное владение не оценивалось."
    },
    {
      "competencyId": "app_08",
      "evidenceAnchor": "growth",
      "relation": "practiced",
      "confidence": "exact",
      "decision": "apply",
      "masteryClaim": null,
      "basis": "На примерах капитализации отрабатывался переход к новой базе процента в каждом следующем году."
    }
  ],
  "warnings": [
    "Rolling KTP-план ученицы пуст: KTP-mapping отсутствует.",
    "Нельзя утверждать повышение освоения навыков по факту прохождения темы; masteryClaim=null."
  ]
}
