{
  "version": 1,
  "studentId": "nastya_pavlova",
  "lessonDate": "2026-10-12",
  "topics": [
    "Массовая доля и концентрация",
    "Смешивание и разбавление растворов",
    "Сплавы и сохранение массы вещества",
    "Высушивание и сухое вещество",
    "Системы уравнений для двух опытов"
  ],
  "actualSummary": "Урок по задачам на растворы, смеси и сплавы: массовая доля, баланс масс при смешивании и разбавлении, равные порции, системы для сплавов, сохранение сухого вещества при высушивании и два эксперимента с общей исходной смесью.",
  "ktpMatches": [],
  "outcomes": [
    {
      "competencyId": "text_13",
      "evidenceAnchor": "mixing",
      "relation": "practiced",
      "confidence": "exact",
      "decision": "apply",
      "masteryClaim": null,
      "basis": "Составлялись таблицы масс и уравнения смешивания растворов и сплавов; ученица выполняла задания по составлению модели."
    },
    {
      "competencyId": "text_14",
      "evidenceAnchor": "base",
      "relation": "practiced",
      "confidence": "exact",
      "decision": "apply",
      "masteryClaim": null,
      "basis": "Разобраны массовая доля и перевод процентов в дробь; аналогичные задачи решались на занятии."
    },
    {
      "competencyId": "text_15",
      "evidenceAnchor": "water",
      "relation": "practiced",
      "confidence": "exact",
      "decision": "apply",
      "masteryClaim": null,
      "basis": "Разбирались и решались задачи об увеличении массы раствора при добавлении чистой воды."
    },
    {
      "competencyId": "text_20",
      "evidenceAnchor": "alloys",
      "relation": "practiced",
      "confidence": "exact",
      "decision": "apply",
      "masteryClaim": null,
      "basis": "Таблицы и системы для смесей/сплавов составлялись во время урока."
    },
    {
      "competencyId": "eq_20",
      "evidenceAnchor": "double",
      "relation": "practiced",
      "confidence": "exact",
      "decision": "apply",
      "masteryClaim": null,
      "basis": "В задачах с двумя экспериментами ученица самостоятельно составляла таблицы и обсуждала уравнения."
    },
    {
      "competencyId": "text_16",
      "evidenceAnchor": "drying",
      "relation": "touched",
      "confidence": "exact",
      "decision": "apply",
      "masteryClaim": null,
      "basis": "Обсуждалась доля сухого вещества в свежих ягодах и изюме, в том числе ошибка выбора влаги вместо сухой части."
    }
  ],
  "warnings": [
    "Rolling KTP план пуст; соответствия по KTP отсутствуют.",
    "Участие в упражнениях подтверждено обсуждением, но нет оснований менять самостоятельный уровень владения; masteryClaim оставлен null."
  ]
}
