{
  "version": 1,
  "studentId": "ekaterina",
  "lessonDate": "2026-10-17",
  "topics": [
    "параллелограмм: свойства и признаки",
    "доказательства через диагонали и средние линии",
    "прямоугольник: свойства и признаки",
    "позиционные системы счисления",
    "триады и тетрады"
  ],
  "actualSummary": "Повторение свойств и признаков параллелограмма, доказательств через треугольники, свойств прямоугольника и переводов между двоичной, восьмеричной, десятичной и шестнадцатеричной системами счисления.",
  "ktpMatches": [],
  "outcomes": [
    {
      "competencyId": "geo_quads_02",
      "evidenceAnchor": "geometry",
      "relation": "touched",
      "confidence": "exact",
      "decision": "apply",
      "masteryClaim": null,
      "basis": "Определение параллелограмма повторено перед решением задач."
    },
    {
      "competencyId": "geo_quads_03",
      "evidenceAnchor": "geometry",
      "relation": "practiced",
      "confidence": "exact",
      "decision": "apply",
      "masteryClaim": null,
      "basis": "Свойства сторон использовались при расчёте периметра, соотношений и в доказательствах."
    },
    {
      "competencyId": "geo_quads_04",
      "evidenceAnchor": "geometry",
      "relation": "practiced",
      "confidence": "exact",
      "decision": "apply",
      "masteryClaim": null,
      "basis": "Углы параллелограмма находились по отношению и свойству суммы соседних углов."
    },
    {
      "competencyId": "geo_quads_05",
      "evidenceAnchor": "geometry",
      "relation": "practiced",
      "confidence": "exact",
      "decision": "apply",
      "masteryClaim": null,
      "basis": "Равенство половин диагоналей применялось для обоснования нового параллелограмма."
    },
    {
      "competencyId": "geo_quads_06",
      "evidenceAnchor": "proofs",
      "relation": "practiced",
      "confidence": "exact",
      "decision": "apply",
      "masteryClaim": null,
      "basis": "Разбирались три признака параллелограмма и письменные доказательства с серединами и диагоналями."
    },
    {
      "competencyId": "geo_quads_07",
      "evidenceAnchor": "rectangle",
      "relation": "practiced",
      "confidence": "exact",
      "decision": "apply",
      "masteryClaim": null,
      "basis": "Свойства и два признака прямоугольника разобраны и использованы в доказательстве."
    }
  ],
  "warnings": [
    "В KTP rolling-plan отсутствуют плановые записи: точных соответствий нет.",
    "Отдельных competency IDs для систем счисления в текущем математическом каталоге нет; тема представлена на странице занятия без искусственного сопоставления.",
    "Связи с компетенциями записаны как touched/practiced; устойчивое освоение не подтверждено отдельной диагностикой, mastery сохраняется."
  ]
}
