{
  "version": 1,
  "studentId": "volodia_khachaturian",
  "lessonDate": "2026-10-16",
  "topics": [
    "второй закон Ньютона",
    "равнодействующая сила",
    "сила и ускорение",
    "сравнение двух состояний",
    "график скорости",
    "выбор формулы кинематики",
    "повторение движения по окружности"
  ],
  "actualSummary": "Изучены равнодействующая и второй закон Ньютона; тренировали выражение силы и ускорения, сравнение двух состояний, чтение графика v(t), движение по прямой наклонной плоскости и перевод в СИ. Повторили период, частоту, угловую и линейную скорости, центростремительное ускорение.",
  "ktpMatches": [],
  "outcomes": [
    {
      "competencyId": "dyn_07",
      "evidenceAnchor": "dynamics",
      "relation": "practiced",
      "confidence": "exact",
      "decision": "apply",
      "masteryClaim": null,
      "basis": "На занятии обсуждалась векторная сумма сил и вычислялся её модуль в задачах о тележке и движущемся теле."
    },
    {
      "competencyId": "dyn_08",
      "evidenceAnchor": "dynamics",
      "relation": "practiced",
      "confidence": "exact",
      "decision": "apply",
      "masteryClaim": null,
      "basis": "Преподаватель и ученик рассчитывали F=ma в задачах по массе и ускорению, затем восстанавливали ускорение из кинематических данных."
    },
    {
      "competencyId": "dyn_09",
      "evidenceAnchor": "balance",
      "relation": "touched",
      "confidence": "exact",
      "decision": "apply",
      "masteryClaim": null,
      "basis": "Рассматривались покой и равномерное прямолинейное движение при a=0; подтверждения самостоятельного владения нет."
    },
    {
      "competencyId": "kin_17",
      "evidenceAnchor": "path",
      "relation": "practiced",
      "confidence": "exact",
      "decision": "apply",
      "masteryClaim": null,
      "basis": "Ученик повторял ускорение как изменение скорости за интервал времени на примере лыжника."
    },
    {
      "competencyId": "kin_20",
      "evidenceAnchor": "path",
      "relation": "practiced",
      "confidence": "exact",
      "decision": "apply",
      "masteryClaim": null,
      "basis": "Использовали s=v₀t+at²/2 для нахождения ускорения бруска при v₀=0."
    },
    {
      "competencyId": "kin_21",
      "evidenceAnchor": "path",
      "relation": "practiced",
      "confidence": "exact",
      "decision": "apply",
      "masteryClaim": null,
      "basis": "Преподаватель повторил соотношение v²-v₀²=2as; ученик сообщил о затруднении при выборе формулы."
    },
    {
      "competencyId": "kin_24",
      "evidenceAnchor": "graph",
      "relation": "practiced",
      "confidence": "exact",
      "decision": "apply",
      "masteryClaim": null,
      "basis": "На прямой v(t) рассматривались точки (4;6), (20;10) и вычислялась равнодействующая автомобиля массой 2000 кг."
    },
    {
      "competencyId": "kin_30",
      "evidenceAnchor": "circle",
      "relation": "touched",
      "confidence": "exact",
      "decision": "apply",
      "masteryClaim": null,
      "basis": "В начале занятия повторена связь ν=1/T и T=1/ν; вспоминание формул требовало подсказок."
    },
    {
      "competencyId": "kin_31",
      "evidenceAnchor": "circle",
      "relation": "touched",
      "confidence": "exact",
      "decision": "apply",
      "masteryClaim": null,
      "basis": "Повторены v=ωR, ω=2πν и v=2πR/T."
    },
    {
      "competencyId": "kin_32",
      "evidenceAnchor": "circle",
      "relation": "touched",
      "confidence": "exact",
      "decision": "apply",
      "masteryClaim": null,
      "basis": "Повторены aц=v²/R и aц=ω²R без самостоятельной диагностики."
    },
    {
      "competencyId": "exam_02",
      "evidenceAnchor": "path",
      "relation": "practiced",
      "confidence": "exact",
      "decision": "apply",
      "masteryClaim": null,
      "basis": "В задачах по разным известным величинам выбирали кинематическую формулу для нахождения ускорения."
    },
    {
      "competencyId": "exam_25",
      "evidenceAnchor": "states",
      "relation": "practiced",
      "confidence": "exact",
      "decision": "apply",
      "masteryClaim": null,
      "basis": "На задачах об изменении массы и силы составляли отношения a₂/a₁ и F₂/F₁, выполняли преобразования дробей."
    },
    {
      "competencyId": "measure_03",
      "evidenceAnchor": "units",
      "relation": "practiced",
      "confidence": "exact",
      "decision": "apply",
      "masteryClaim": null,
      "basis": "В задаче о наклонной плоскости переводили 15 сантиметров в 0,15 метра и записывали единицы ускорения."
    }
  ],
  "warnings": [
    "В транскрипте первое условие о двукратном изменении массы произносилось противоречиво; на странице отдельно рассмотрены корректные варианты увеличения и уменьшения массы.",
    "Повышение mastery не заявлено: задачи выполнялись при участии преподавателя."
  ]
}
