{
  "version": 1,
  "studentId": "kirill_zinoviev",
  "lessonDate": "2026-10-14",
  "topics": [
    "числовая ось и лучи",
    "строгие и нестрогие неравенства",
    "интервальная запись",
    "включённость границ",
    "скобки и бесконечности",
    "составление уравнения по тексту"
  ],
  "actualSummary": "Числовая ось, строгие и нестрогие неравенства, включённость границ, запись промежутков со скобками, бесконечности и составление уравнения по условию текстовой задачи.",
  "ktpMatches": [],
  "outcomes": [
    {
      "competencyId": "rational_1",
      "evidenceAnchor": "one-sided",
      "relation": "practiced",
      "confidence": "exact",
      "decision": "apply",
      "masteryClaim": null,
      "basis": "Ученик переводил четыре примера выделенных лучей в неравенства и затем в запись промежутков; преподаватель проверил выполненные записи."
    },
    {
      "competencyId": "rational_2",
      "evidenceAnchor": "bounded",
      "relation": "practiced",
      "confidence": "exact",
      "decision": "apply",
      "masteryClaim": null,
      "basis": "Разбирались пары чисел и включённость граничных значений, в том числе 4 и 12, а также числа между ними."
    },
    {
      "competencyId": "models_3",
      "evidenceAnchor": "word-problem",
      "relation": "practiced",
      "confidence": "exact",
      "decision": "apply",
      "masteryClaim": null,
      "basis": "Разбиралась школьная задача о Маше и Васе, включая затруднение при переносе фразы «в 3 раза больше» в уравнение."
    },
    {
      "competencyId": "equations_12",
      "evidenceAnchor": "word-problem",
      "relation": "practiced",
      "confidence": "exact",
      "decision": "apply",
      "masteryClaim": null,
      "basis": "Преподаватель составлял таблицу до/после трат и объяснял связь x−6=3(x−14); ученик уточнял положение множителя."
    },
    {
      "competencyId": "equations_7",
      "evidenceAnchor": "word-problem",
      "relation": "touched",
      "confidence": "exact",
      "decision": "apply",
      "masteryClaim": null,
      "basis": "Преподаватель показал преобразование x−6=3(x−14) и результат x=18. Самостоятельное решение учеником по записи не подтверждено."
    }
  ],
  "warnings": [
    "В скользящем КТП пока нет плановых записей, сопоставление KTP не выполняется.",
    "Отдельной компетенции для интервальной записи в текущем каталоге нет; использованы только существующие навыки координатной прямой и сравнения чисел.",
    "Урок содержит практику и объяснения, но автоматическое повышение mastery без независимой диагностики не обосновано."
  ]
}
