{
  "version": 1,
  "studentId": "kirill_zinoviev",
  "lessonDate": "2026-10-25",
  "topics": [
    "упорядоченный числовой ряд",
    "среднее арифметическое и обратные задачи",
    "медиана для чётного и нечётного количества значений",
    "размах",
    "влияние крайних значений на статистические характеристики"
  ],
  "actualSummary": "На занятии разобраны среднее арифметическое, медиана и размах; восстановление суммы по среднему, поиск неизвестного значения, новое среднее при добавлении дня, чувствительность к крайним значениям.",
  "ktpMatches": [],
  "outcomes": [
    {
      "competencyId": "stats_5",
      "evidenceAnchor": "mean",
      "relation": "practiced",
      "confidence": "exact",
      "decision": "apply",
      "masteryClaim": null,
      "basis": "На уроке ученик вычислял средние и решал уравнение для неизвестного значения."
    },
    {
      "competencyId": "stats_6",
      "evidenceAnchor": "median",
      "relation": "practiced",
      "confidence": "exact",
      "decision": "apply",
      "masteryClaim": null,
      "basis": "На уроке были решены задания на поиск медианы и сравнение медиан двух рядов."
    },
    {
      "competencyId": "stats_8",
      "evidenceAnchor": "range",
      "relation": "practiced",
      "confidence": "exact",
      "decision": "apply",
      "masteryClaim": null,
      "basis": "Обсуждались размах, его неотрицательность и самостоятельное вычисление крайних значений."
    },
    {
      "competencyId": "stats_12",
      "evidenceAnchor": "compare",
      "relation": "touched",
      "confidence": "exact",
      "decision": "apply",
      "masteryClaim": null,
      "basis": "Преподаватель разбирал влияние крайнего числа на среднее и медиану; отдельная независимая проверка не проведена."
    }
  ],
  "warnings": [
    "Rolling KTP is empty: no mapping claimed.",
    "Guided lesson activity is evidence of touched/practiced concepts only; no mastery increase."
  ]
}
