{
  "version": 1,
  "studentId": "matvey_gorbachev",
  "lessonDate": "2026-10-22",
  "topics": [
    "распознавание аннуитетной и дифференцированной схем",
    "вклады с пополнением и аннуитетная формула",
    "произвольные остатки долга и таблица платежей",
    "переплата и строгие ограничения на каждый платёж",
    "смешанная схема: сначала проценты, затем равные платежи"
  ],
  "actualSummary": "Матвей Горбачёв. Финансовые задачи ЕГЭ: кредиты и вклады, аннуитетная, дифференцированная, произвольная и смешанная схемы, таблица долга, переплата и целочисленные ограничения. Путь А — 10 заданий.",
  "ktpMatches": [],
  "outcomes": [
    {
      "competencyId": "finance_04",
      "evidenceAnchor": "annuity",
      "relation": "touched",
      "confidence": "exact",
      "decision": "apply",
      "masteryClaim": null,
      "basis": "Вспомнили и применили формулу равных платежей при трёхлетнем кредите; объяснение и разбор под руководством преподавателя."
    },
    {
      "competencyId": "finance_05",
      "evidenceAnchor": "diff",
      "relation": "touched",
      "confidence": "exact",
      "decision": "apply",
      "masteryClaim": null,
      "basis": "Повторили отличие равных долей основного долга от равных платежей."
    },
    {
      "competencyId": "finance_06",
      "evidenceAnchor": "recurrence",
      "relation": "touched",
      "confidence": "exact",
      "decision": "apply",
      "masteryClaim": null,
      "basis": "Обсуждался переход от одной строки задолженности к следующей, включая рекуррентную модель."
    },
    {
      "competencyId": "finance_07",
      "evidenceAnchor": "model",
      "relation": "practiced",
      "confidence": "exact",
      "decision": "apply",
      "masteryClaim": null,
      "basis": "Ученик участвовал в заполнении таблицы остатков по заданным долям, проверял расчёты."
    },
    {
      "competencyId": "finance_08",
      "evidenceAnchor": "models",
      "relation": "touched",
      "confidence": "exact",
      "decision": "apply",
      "masteryClaim": null,
      "basis": "Обсуждали различение схем по ключевым формулировкам условия."
    },
    {
      "competencyId": "finance_09",
      "evidenceAnchor": "deposit",
      "relation": "touched",
      "confidence": "exact",
      "decision": "apply",
      "masteryClaim": null,
      "basis": "Решалась задача о вкладе с пополнениями и различной длительностью начисления процентов."
    },
    {
      "competencyId": "finance_11",
      "evidenceAnchor": "model",
      "relation": "practiced",
      "confidence": "exact",
      "decision": "apply",
      "masteryClaim": null,
      "basis": "Ученик представил расчётную таблицу; преподаватель проверил проценты, платежи и остатки."
    },
    {
      "competencyId": "finance_12",
      "evidenceAnchor": "constraints",
      "relation": "practiced",
      "confidence": "exact",
      "decision": "apply",
      "masteryClaim": null,
      "basis": "Ученик совместно с преподавателем решал систему строгих ограничений и выбирал целое значение S."
    }
  ],
  "warnings": [
    "Rolling-КТП не содержит плановых записей: привязки KTP не создаются.",
    "Совместная работа и объяснение не подтверждают повышение уровня освоения."
  ]
}
