{
  "version": 1,
  "studentId": "kirill_zinoviev",
  "lessonDate": "2026-10-28",
  "topics": [
    "медиана треугольника и середина стороны",
    "биссектриса и равные углы",
    "высота и перпендикуляр к стороне или её продолжению",
    "три точки пересечения",
    "обозначения и чтение чертежа"
  ],
  "actualSummary": "Геометрия, 7 класс. Медианы, биссектрисы и высоты: определения, построения, вычисления, общие точки пересечения и 10 заданий.",
  "ktpMatches": [],
  "outcomes": [
    {
      "competencyId": "triangles_5",
      "evidenceAnchor": "median",
      "relation": "practiced",
      "confidence": "exact",
      "decision": "apply",
      "masteryClaim": null,
      "basis": "Кирилл распознал медиану и решал задачи на половины стороны."
    },
    {
      "competencyId": "triangles_6",
      "evidenceAnchor": "bisector",
      "relation": "practiced",
      "confidence": "exact",
      "decision": "apply",
      "masteryClaim": null,
      "basis": "Кирилл распознал биссектрису и находил равные половины угла."
    },
    {
      "competencyId": "triangles_7",
      "evidenceAnchor": "altitude",
      "relation": "practiced",
      "confidence": "exact",
      "decision": "apply",
      "masteryClaim": null,
      "basis": "Построение высоты из вершины выполнялось под руководством преподавателя; обсуждалось продолжение стороны."
    },
    {
      "competencyId": "triangles_13",
      "evidenceAnchor": "reading",
      "relation": "touched",
      "confidence": "exact",
      "decision": "apply",
      "masteryClaim": null,
      "basis": "В беседе упоминалась сумма внутренних углов треугольника 180 градусов."
    },
    {
      "competencyId": "geo_reason_8",
      "evidenceAnchor": "reading",
      "relation": "practiced",
      "confidence": "exact",
      "decision": "apply",
      "masteryClaim": null,
      "basis": "Разобраны обозначения точек, одинаковые засечки, дуги и прямые углы на чертеже."
    }
  ],
  "warnings": []
}
