{
  "version": 1,
  "studentId": "denis_ermolaev",
  "lessonDate": "2026-10-16",
  "topics": [
    "Свойства степеней с целыми и дробными показателями",
    "Преобразование показательных выражений",
    "Прикладные задачи на степени и показательные уравнения",
    "Показательная функция и метод опорных точек"
  ],
  "actualSummary": "Повторены свойства степеней, преобразование корней и дробей к общему основанию. Выполнены вычисления со степенями, рассмотрены газовые модели и радиоактивный распад; восстановлена формула показательной функции по двум опорным точкам.",
  "ktpMatches": [],
  "outcomes": [
    {
      "competencyId": "calc_09",
      "evidenceAnchor": "theory",
      "relation": "touched",
      "confidence": "exact",
      "decision": "apply",
      "masteryClaim": null,
      "basis": "Повторены правила целой степени и ограничения на основания."
    },
    {
      "competencyId": "calc_10",
      "evidenceAnchor": "calc-roots",
      "relation": "practiced",
      "confidence": "exact",
      "decision": "apply",
      "masteryClaim": null,
      "basis": "Вычисления с дробными показателями и корнями разобраны в ходе занятия; ученик решал аналогичные упражнения."
    },
    {
      "competencyId": "expr_12",
      "evidenceAnchor": "calc-powers",
      "relation": "practiced",
      "confidence": "exact",
      "decision": "apply",
      "masteryClaim": null,
      "basis": "Выполнялись преобразования составного основания и сложение показателей."
    },
    {
      "competencyId": "expr_15",
      "evidenceAnchor": "calc-negative",
      "relation": "practiced",
      "confidence": "exact",
      "decision": "apply",
      "masteryClaim": null,
      "basis": "Разобраны и отрабатывались преобразования показательных выражений, включая иррациональные показатели."
    },
    {
      "competencyId": "eq_09",
      "evidenceAnchor": "decay",
      "relation": "touched",
      "confidence": "exact",
      "decision": "apply",
      "masteryClaim": null,
      "basis": "Разобрано сведение 2^(−t/T)=2^k к равенству показателей в модели распада."
    },
    {
      "competencyId": "text_17",
      "evidenceAnchor": "two-states",
      "relation": "practiced",
      "confidence": "exact",
      "decision": "apply",
      "masteryClaim": null,
      "basis": "Рассмотрены два состояния газа и переход от словесного условия к уравнению."
    },
    {
      "competencyId": "func_13",
      "evidenceAnchor": "graph-points",
      "relation": "touched",
      "confidence": "exact",
      "decision": "apply",
      "masteryClaim": null,
      "basis": "Показан метод восстановления a и b по точкам графика показательной функции."
    }
  ],
  "warnings": [
    "В текущем КТП ученика отсутствуют плановые уроки: привязка к KTP не выполняется до появления проверенного плана.",
    "Во время занятия проводилась тренировка; независимого диагностического evidence для повышения уровня освоения недостаточно."
  ]
}
